<?xml version="1.0" encoding="UTF-8"?>
<catalogo xmlns:xsi="http://www.w3.org/2001/XMLSchema-instance" xsi:noNamespaceSchemaLocation="xsd_ejercicio_5.xsd">
    <modelo>
        <id_modelo>QWZ5671</id_modelo>
        <precio>39.95</precio>
        <tallas>
            <medium>
                <color>Red</color>
                <color>Blue</color>
            </medium>
            <large>
                <color>Red</color>
                <color>Burgundy</color>
            </large>
        </tallas>
    </modelo>
    <opiniones>
        <opinion>Muy ponible en cualquier situaci√≥n</opinion>
    </opiniones>
</catalogo>